{
  "schemaVersion": 1,
  "requestId": "ctx-request-synthetic-20400116",
  "purpose": "Günlük denge için açıklanabilir seçenekler hazırlama",
  "requestedAt": "2040-01-16T12:00:00.000Z",
  "window": {
    "startDate": "2040-01-14",
    "endDate": "2040-01-15",
    "maxEventsPerSource": 20
  },
  "consent": {
    "schemaVersion": 1,
    "consentId": "consent-synthetic-20400114",
    "purpose": "Günlük denge için açıklanabilir seçenekler hazırlama",
    "granted": true,
    "grantedAt": "2040-01-14T08:00:00.000Z",
    "revokedAt": null,
    "processing": {
      "mode": "device-only",
      "externalRecipient": null,
      "retention": "request-scoped"
    },
    "permissions": {
      "core": {
        "allowed": true,
        "dataClasses": ["daily-choice", "color"],
        "includeFreeText": false
      },
      "health": {
        "allowed": true,
        "dataClasses": ["sleep", "energy", "activity", "hydration"],
        "includeFreeText": false
      },
      "sky": {
        "allowed": true,
        "dataClasses": ["core-sky-snapshot"],
        "includeFreeText": false,
        "role": "symbolic-context-only"
      }
    }
  },
  "events": [
    {
      "schemaVersion": 1,
      "eventId": "core-20400115",
      "source": "today-core",
      "eventType": "daily-checkin",
      "createdAt": "2040-01-15T18:05:00.000Z",
      "localDate": "2040-01-15",
      "payload": {
        "choice": "C",
        "color": "mavi",
        "note": "SENTETIK_GIZLI_NOT_CONTEXTE_GIRMEMELI",
        "changeLog": [{ "from": "B", "to": "C" }]
      }
    },
    {
      "schemaVersion": 1,
      "eventId": "sleep-20400115",
      "source": "today-health",
      "eventType": "sleep-record",
      "createdAt": "2040-01-15T07:10:00.000Z",
      "localDate": "2040-01-15",
      "payload": {
        "dayKey": "2040-01-15",
        "date": "2040-01-15",
        "bedtime": "00:30",
        "wakeTime": "07:00",
        "durationMinutes": 390,
        "quality": 3,
        "recovery": 2,
        "note": "SENTETIK_UYKU_NOTU_CONTEXTE_GIRMEMELI"
      }
    },
    {
      "schemaVersion": 1,
      "eventId": "energy-20400115",
      "source": "today-health",
      "eventType": "energy-record",
      "createdAt": "2040-01-15T12:00:00.000Z",
      "localDate": "2040-01-15",
      "payload": {
        "energy": 3,
        "fatigue": 2,
        "body": 3,
        "note": "SENTETIK_ENERJI_NOTU_CONTEXTE_GIRMEMELI"
      }
    },
    {
      "schemaVersion": 1,
      "eventId": "symptoms-20400115",
      "source": "today-health",
      "eventType": "symptom-record",
      "createdAt": "2040-01-15T13:00:00.000Z",
      "localDate": "2040-01-15",
      "payload": {
        "symptoms": ["sentetik-bas-agrisi"],
        "severity": 2,
        "note": "SENTETIK_BELIRTI_NOTU_CONTEXTE_GIRMEMELI"
      }
    },
    {
      "schemaVersion": 1,
      "eventId": "workout-20400114",
      "source": "today-health",
      "eventType": "workout-record",
      "createdAt": "2040-01-14T19:00:00.000Z",
      "localDate": "2040-01-14",
      "payload": {
        "date": "2040-01-14",
        "dayIndex": 1,
        "dayTitle": "Sentetik gün",
        "durationMinutes": 32,
        "exercises": [
          {
            "exerciseId": "synthetic-exercise-1",
            "name": "SENTETIK_EGZERSIZ_ADI_CONTEXTE_GIRMEMELI",
            "muscle": "sentetik-kas",
            "image": "synthetic-private-image.png",
            "sets": 3,
            "reps": 8,
            "kg": 42,
            "completed": true
          }
        ]
      }
    },
    {
      "schemaVersion": 1,
      "eventId": "hydration-20400115",
      "source": "today-health",
      "eventType": "nutrition-record",
      "createdAt": "2040-01-15T16:00:00.000Z",
      "localDate": "2040-01-15",
      "payload": {
        "id": "nutrition-synthetic-hydration-1",
        "type": "hydration_entry",
        "schemaVersion": 1,
        "createdAt": "2040-01-15T16:00:00.000Z",
        "updatedAt": "2040-01-15T16:00:00.000Z",
        "eventAt": "2040-01-15T15:55:00.000Z",
        "source": { "kind": "manual" },
        "knowledgeStatus": "known",
        "recordStatus": "active",
        "verificationStatus": "user_confirmed",
        "calculationVersion": "synthetic-v1",
        "userEdited": false,
        "payload": {
          "amountMl": 350,
          "note": "SENTETIK_BESLENME_NOTU_CONTEXTE_GIRMEMELI"
        }
      }
    },
    {
      "schemaVersion": 1,
      "eventId": "sky-link-20400115",
      "source": "today-sky",
      "eventType": "core-sky-symbolic-snapshot",
      "createdAt": "2040-01-15T18:06:00.000Z",
      "localDate": "2040-01-15",
      "payload": {
        "contractVersion": 1,
        "dateKey": "2040-01-15",
        "linkedAt": "2040-01-15T18:06:00.000Z",
        "linkMode": "user_initiated_snapshot",
        "place": {
          "source": "geonames",
          "geonameId": 999999,
          "label": "SENTETIK_HASSAS_KONUM_CONTEXTE_GIRMEMELI",
          "latitude": 12.345678,
          "longitude": 98.765432,
          "timezoneId": "Etc/UTC",
          "catalogVersion": "synthetic"
        },
        "sky": {
          "instant": "2040-01-15T18:06:00.000Z",
          "clock": {
            "localDateKey": "2040-01-15",
            "localTime": "21:06",
            "utcOffset": "+03:00",
            "timezoneId": "SENTETIK_GIZLI_TIMEZONE"
          },
          "planets": [
            { "id": "sun", "longitude": 10, "signId": "aries", "degreeInSign": 10, "house": 1 },
            { "id": "moon", "longitude": 40, "signId": "taurus", "degreeInSign": 10, "house": 2 },
            { "id": "mercury", "longitude": 70, "signId": "gemini", "degreeInSign": 10, "house": 3 },
            { "id": "venus", "longitude": 100, "signId": "cancer", "degreeInSign": 10, "house": 4 },
            { "id": "mars", "longitude": 130, "signId": "leo", "degreeInSign": 10, "house": 5 },
            { "id": "jupiter", "longitude": 160, "signId": "virgo", "degreeInSign": 10, "house": 6 },
            { "id": "saturn", "longitude": 190, "signId": "libra", "degreeInSign": 10, "house": 7 },
            { "id": "uranus", "longitude": 220, "signId": "scorpio", "degreeInSign": 10, "house": 8 },
            { "id": "neptune", "longitude": 250, "signId": "sagittarius", "degreeInSign": 10, "house": 9 },
            { "id": "pluto", "longitude": 280, "signId": "capricorn", "degreeInSign": 10, "house": 10 }
          ],
          "angles": {
            "ascendant": { "longitude": 10, "signId": "aries", "degreeInSign": 10 },
            "midheaven": { "longitude": 100, "signId": "cancer", "degreeInSign": 10 }
          },
          "aspects": [
            { "type": "trine", "orb": 2, "left": { "id": "sun" }, "right": { "id": "moon" } }
          ]
        },
        "metadata": {
          "rulesetId": "today:core-sky-link:nut-016.6",
          "interpretation": "none",
          "causalityClaim": false,
          "aiProcessed": false
        }
      }
    },
    {
      "schemaVersion": 1,
      "eventId": "sky-birth-profile-synthetic",
      "source": "today-sky",
      "eventType": "sky-birth-profile",
      "createdAt": "2040-01-14T08:00:00.000Z",
      "localDate": "2040-01-14",
      "payload": {
        "birthDate": "1990-01-01",
        "birthTime": "01:23",
        "birthPlace": "SENTETIK_DOGUM_YERI_CONTEXTE_GIRMEMELI"
      }
    },
    {
      "schemaVersion": 1,
      "eventId": "core-outside-window",
      "source": "today-core",
      "eventType": "daily-checkin",
      "createdAt": "2040-01-10T12:00:00.000Z",
      "localDate": "2040-01-10",
      "payload": { "choice": "A", "color": "yesil" }
    },
    {
      "schemaVersion": 1,
      "eventId": "energy-20400115",
      "source": "today-health",
      "eventType": "energy-record",
      "createdAt": "2040-01-15T12:01:00.000Z",
      "localDate": "2040-01-15",
      "payload": { "energy": 5, "fatigue": 1, "body": 5 }
    }
  ]
}
